anime_id,title,title_english,title_japanese,title_synonyms,image_url,type,source,episodes,status,airing,aired_string,aired,duration,rating,score,scored_by,rank,popularity_rank,members,favorites,background,premiered,broadcast,related,producer,licensor,studio,genre,opening_theme,ending_theme,duration_min,aired_from_year,weighted_avg,popularity_score,normalized_weight,normalized_popularity,normalized_fav,final_score
966,Crayon Shin-chan,Shin Chan,クレヨンしんちゃん,,https://myanimelist.cdn-dena.com/images/anime/10/59897.jpg,TV,Manga,0,Currently Airing,True,"Apr 13, 1992 to ?","{'from': '1992-04-13', 'to': None}",21 min.,PG - Children,7.73,17683,1032.0,1937,34788,600,"The first English dubbed version was produced with many famous voice actors through 2001&ndash;2002 by Vitello Productions. In 2004, Phuuz Entertainment produced a continuation of the Vitello dub with different Los Angeles-based voice actors. The Phuuz and Vitello dub aired in the United Kingdom, Australia, and Republic of Ireland, and translations of these dubs aired in Europe and Latin America. The dubs were close to the original but had seen some censorship. The English dubbed version by Funimation was produced in 2005, featuring a Texas-based cast of voice actors, and was altered in comparison to the original&mdash;sexual references, dark humor, and references to popular American culture were added later on. Additionally, many non-existent backstories and different personalities were created.Crayon Shin-chan has also been adapted into video games, mobile games and tons of anime movies.",Spring 1992,Fridays at 19:30 (JST),"{'Adaptation': [{'mal_id': 2435, 'type': 'manga', 'url': 'https://myanimelist.net/manga/2435/Crayon_Shin-chan', 'title': 'Crayon Shin-chan'}], 'Side story': [{'mal_id': 2172, 'type': 'anime', 'url': 'https://myanimelist.net/anime/2172/Crayon_Shin-chan_Movie_15__Arashi_wo_Yobu_Utau_Ketsu_dake_Bakudan', 'title': 'Crayon Shin-chan Movie 15: Arashi wo Yobu Utau Ketsu dake Bakudan!'}, {'mal_id': 2450, 'type': 'anime', 'url': 'https://myanimelist.net/anime/2450/Crayon_Shin-chan_Movie_09__Arashi_wo_Yobu_Mouretsu_Otona_Teikoku_no_Gyakushuu', 'title': 'Crayon Shin-chan Movie 09: Arashi wo Yobu Mouretsu! Otona Teikoku no Gyakushuu'}, {'mal_id': 3744, 'type': 'anime', 'url': 'https://myanimelist.net/anime/3744/Crayon_Shin-chan_Movie_10__Arashi_wo_Yobu_Appare_Sengoku_Daikassen', 'title': 'Crayon Shin-chan Movie 10: Arashi wo Yobu Appare! Sengoku Daikassen'}, {'mal_id': 3745, 'type': 'anime', 'url': 'https://myanimelist.net/anime/3745/Crayon_Shin-chan_Movie_02__Buriburi_Oukoku_no_Hihou', 'title': 'Crayon Shin-chan Movie 02: Buriburi Oukoku no Hihou'}, {'mal_id': 3853, 'type': 'anime', 'url': 'https://myanimelist.net/anime/3853/Crayon_Shin-chan_Manatsu_no_Yoru_ni_Ora_Sanjou_Arashi_wo_Yobu_Den-O_vs_Shin-O_60-bu_Special', 'title': 'Crayon Shin-chan Manatsu no Yoru ni Ora Sanjou! Arashi wo Yobu Den-O vs. Shin-O 60-bu Special!!'}, {'mal_id': 6217, 'type': 'anime', 'url': 'https://myanimelist.net/anime/6217/Crayon_Shin-chan_Movie_03__Unkokusai_no_Yabou', 'title': 'Crayon Shin-chan Movie 03: Unkokusai no Yabou'}, {'mal_id': 6460, 'type': 'anime', 'url': 'https://myanimelist.net/anime/6460/Crayon_Shin-chan_Movie_05__Ankoku_Tamatama_Daitsuiseki', 'title': 'Crayon Shin-chan Movie 05: Ankoku Tamatama Daitsuiseki'}, {'mal_id': 8358, 'type': 'anime', 'url': 'https://myanimelist.net/anime/8358/Crayon_Shin-chan_Movie_01__Action_Kamen_vs_Haigure_Maou', 'title': 'Crayon Shin-chan Movie 01: Action Kamen vs. Haigure Maou'}, {'mal_id': 8359, 'type': 'anime', 'url': 'https://myanimelist.net/anime/8359/Crayon_Shin-chan_Movie_04__Henderland_no_Daibouken', 'title': 'Crayon Shin-chan Movie 04: Henderland no Daibouken'}, {'mal_id': 8360, 'type': 'anime', 'url': 'https://myanimelist.net/anime/8360/Crayon_Shin-chan_Movie_06__Dengeki_Buta_no_Hizume_Daisakusen', 'title': 'Crayon Shin-chan Movie 06: Dengeki! Buta no Hizume Daisakusen'}, {'mal_id': 8361, 'type': 'anime', 'url': 'https://myanimelist.net/anime/8361/Crayon_Shin-chan_Movie_07__Bakuhatsu_Onsen_Wakuwaku_Daikessen', 'title': 'Crayon Shin-chan Movie 07: Bakuhatsu! Onsen Wakuwaku Daikessen'}, {'mal_id': 8362, 'type': 'anime', 'url': 'https://myanimelist.net/anime/8362/Crayon_Shin-chan_Movie_08__Arashi_wo_Yobu_Jungle', 'title': 'Crayon Shin-chan Movie 08: Arashi wo Yobu Jungle'}, {'mal_id': 8363, 'type': 'anime', 'url': 'https://myanimelist.net/anime/8363/Crayon_Shin-chan_Movie_11__Arashi_wo_Yobu_Eikou_no_Yakiniku_Road', 'title': 'Crayon Shin-chan Movie 11: Arashi wo Yobu Eikou no Yakiniku Road'}, {'mal_id': 8364, 'type': 'anime', 'url': 'https://myanimelist.net/anime/8364/Crayon_Shin-chan_Movie_12__Arashi_wo_Yobu_Yuuhi_no_Kasukabe_Boys', 'title': 'Crayon Shin-chan Movie 12: Arashi wo Yobu! Yuuhi no Kasukabe Boys'}, {'mal_id': 8365, 'type': 'anime', 'url': 'https://myanimelist.net/anime/8365/Crayon_Shin-chan_Movie_13__Densetsu_wo_Yobu_Buriburi_3_Pun_Dai_Shingeki', 'title': 'Crayon Shin-chan Movie 13: Densetsu wo Yobu Buriburi 3 Pun Dai Shingeki'}, {'mal_id': 8366, 'type': 'anime', 'url': 'https://myanimelist.net/anime/8366/Crayon_Shin-chan_Movie_14__Densetsu_wo_Yobu_Odore_Amigo', 'title': 'Crayon Shin-chan Movie 14: Densetsu wo Yobu Odore! Amigo!'}, {'mal_id': 8367, 'type': 'anime', 'url': 'https://myanimelist.net/anime/8367/Crayon_Shin-chan_Movie_16__Chou_Arashi_wo_Yobu_Kinpoko_no_Yuusha', 'title': 'Crayon Shin-chan Movie 16: Chou Arashi wo Yobu Kinpoko no Yuusha'}, {'mal_id': 8368, 'type': 'anime', 'url': 'https://myanimelist.net/anime/8368/Crayon_Shin-chan_Movie_17__Otakebe_Kasukabe_Yasei_Oukoku', 'title': 'Crayon Shin-chan Movie 17: Otakebe! Kasukabe Yasei Oukoku'}, {'mal_id': 8369, 'type': 'anime', 'url': 'https://myanimelist.net/anime/8369/Crayon_Shin-chan_Movie_18__Chou_Jikuu_Arashi_wo_Yobu_Ora_no_Hanayome', 'title': 'Crayon Shin-chan Movie 18: Chou Jikuu! Arashi wo Yobu Ora no Hanayome'}, {'mal_id': 10116, 'type': 'anime', 'url': 'https://myanimelist.net/anime/10116/Crayon_Shin-chan_Movie_19__Arashi_wo_Yobu_Ougon_no_Spy_Daisakusen', 'title': 'Crayon Shin-chan Movie 19: Arashi wo Yobu Ougon no Spy Daisakusen'}, {'mal_id': 12499, 'type': 'anime', 'url': 'https://myanimelist.net/anime/12499/Crayon_Shin-chan_Movie_20__Arashi_wo_Yobu_Ora_to_Uchuu_no_Princess', 'title': 'Crayon Shin-chan Movie 20: Arashi wo Yobu! Ora to Uchuu no Princess'}, {'mal_id': 17113, 'type': 'anime', 'url': 'https://myanimelist.net/anime/17113/Crayon_Shin-chan_Movie_21__Bakauma_B-Kyuu_Gourmet_Survival_Battle', 'title': 'Crayon Shin-chan Movie 21: Bakauma! B-Kyuu Gourmet Survival Battle!!'}, {'mal_id': 21395, 'type': 'anime', 'url': 'https://myanimelist.net/anime/21395/Crayon_Shin-chan_Movie_22__Gachinko_Gyakushuu_no_Robo_To-chan', 'title': 'Crayon Shin-chan Movie 22: Gachinko! Gyakushuu no Robo To-chan'}, {'mal_id': 27653, 'type': 'anime', 'url': 'https://myanimelist.net/anime/27653/Crayon_Shin-chan_Movie_23__Ora_no_Hikkoshi_Monogatari_-_Saboten_Daisuugeki', 'title': 'Crayon Shin-chan Movie 23: Ora no Hikkoshi Monogatari - Saboten Daisuugeki'}, {'mal_id': 31978, 'type': 'anime', 'url': 'https://myanimelist.net/anime/31978/Crayon_Shin-chan_Movie_24__Bakusui_Yumemi_World_Dai_Totsugeki', 'title': 'Crayon Shin-chan Movie 24: Bakusui! Yumemi World Dai Totsugeki'}, {'mal_id': 34244, 'type': 'anime', 'url': 'https://myanimelist.net/anime/34244/Crayon_Shin-chan_Movie_25__Shin-chan_Shuurai_Uchuujin_Shiriri', 'title': 'Crayon Shin-chan Movie 25: Shin-chan Shuurai! Uchuujin Shiriri'}, {'mal_id': 35686, 'type': 'anime', 'url': 'https://myanimelist.net/anime/35686/Doraemon_2005_Specials', 'title': 'Doraemon (2005) Specials'}, {'mal_id': 36566, 'type': 'anime', 'url': 'https://myanimelist.net/anime/36566/Crayon_Shin-chan_Movie_26__Bakumori_Kung_Fu_Boys_-_Ramen_Tairan', 'title': 'Crayon Shin-chan Movie 26: Bakumori! Kung Fu Boys - Ramen Tairan'}], 'Spin-off': [{'mal_id': 9799, 'type': 'anime', 'url': 'https://myanimelist.net/anime/9799/Shin-Men', 'title': 'Shin-Men'}], 'Other': [{'mal_id': 14095, 'type': 'anime', 'url': 'https://myanimelist.net/anime/14095/Kamen_Rider_Fourze_x_Crayon_Shin-chan', 'title': 'Kamen Rider Fourze x Crayon Shin-chan'}, {'mal_id': 33661, 'type': 'anime', 'url': 'https://myanimelist.net/anime/33661/Crayon_Shin-chan_Gaiden__Alien_vs_Shinnosuke', 'title': 'Crayon Shin-chan Gaiden: Alien vs. Shinnosuke'}, {'mal_id': 34314, 'type': 'anime', 'url': 'https://myanimelist.net/anime/34314/Crayon_Shin-chan_Gaiden__Omocha_Wars', 'title': 'Crayon Shin-chan Gaiden: Omocha Wars'}, {'mal_id': 34835, 'type': 'anime', 'url': 'https://myanimelist.net/anime/34835/Crayon_Shin-chan_Gaiden__Kazokuzure_Ookami', 'title': 'Crayon Shin-chan Gaiden: Kazokuzure Ookami'}, {'mal_id': 35652, 'type': 'anime', 'url': 'https://myanimelist.net/anime/35652/Crayon_Shin-chan_Gaiden__O-o-o_no_Shinnosuke', 'title': 'Crayon Shin-chan Gaiden: O-o-o no Shinnosuke'}]}",TV Asahi,Funimation,Shin-Ei Animation,"Slice of Life, Comedy, Ecchi, School, Seinen","['#01: ""Doubutsuen wa Taihen da"" by Tune&#039;s', '#02: ""Yume no End wa Itsumo Mezamashi!"" by B.B.Queens', '#03: ""Bakappo de Go!"" by Akiko Yajima', '#04: ""Ora wa Ninkimono"" by Akiko Yajima', '#05: ""Nenjuu Muchuu ~I Want You~"" by Puppy', '#06: ""Tobe Tobe Onei-san"" by Akiko Yajima & Tesshou Genda', '#07: ""Dame Dame no Uta"" by Lady Q, Akiko Yajima & Miki Narahashi', '#08: ""Pleasure"" by Tomomi Kahala', '#09: ""Leisurely De-o!"" by Akiko Yajima', '#10: ""Leisurely De-o! ~Crayon Friends 2007 Version~"" by Akiko Yajima and AKB48', '#11: ""Leisurely De-o! (Regular Version)"" by Akiko Yajima and AKB48', '#12: ""Hapihapi"" by Becky♪♯', '#13: ""T.W.L"" by Kan Jani Eight (関ジャニ∞)', '#14: ""Kibou Sanmyaku (希望山脈)"" by Watari Rouka wa Shiritai 7 (渡り廊下走り隊7)', '#15: ""Kimi ni 100 Percent (キミに100パーセント)"" by Kyary Pamyu Pamyu']","['#01: ""Uta wo Utaou"" by Daiji-Man Brothers Band', '#02: ""Sunao ni Naritai"" by Hiromi Yonemura', '#03: ""Do-shite"" by Sakurakko Club - Sakura-kumi', '#04: ""Reggae"" by Kotone', '#05: ""Party Join Us Daisakusen"" by Maron Koushaku & Akiko Yajima', '#06: ""Shin-chan Ondo"" by Haruo Minami & Akiko Yajima', '#07: ""Boys Be Brave ~Shounen yo Yuuki wo Mote~"" by Aki Okui', '#08: ""Tsukiakari Funwari Ochitekuru Yoru"" by Nanami Ogawa', '#09: ""Suki Suki - My Girl"" by L&#039;luvia', '#10: ""Ora wa Ninkimono"" by Akiko Yajima, Keiji Fujiwara & Miki Narahashi', '#11: ""Sayonara Arigatou"" by Sachiko Kobayashi', '#12: ""Kyou wa Date"" by Kamaboko', '#13: ""Genki de Ite ne"" by Sachiko Kobayashi', '#14: ""Zentaiteki ni Daisuki Desu."" by Sheki-Dol', '#15: ""Nichuu no Fantasy ~Taiiku wo Yasumi Onna no Ko Hen~"" by Dance Man', '#16: ""Mama to no O-yakusoku Joukou no Uta"" by Akiko Yajima & Miki Narahashi', '#17: ""Konna Toki ni Koso Yakiniku ga Aru"" by the Nohara Family All Stars', '#18: ""OLA!!"" by Yuzu']",21.0,1992.0,7.725915695925955,4647,0.9303594806713109,0.8064231515793189,0.06629870433603069,0.5950168410735979
74,Gakuen Alice,Gakuen Alice,学園アリス,"Campus Alice, Alice Academy",https://myanimelist.cdn-dena.com/images/anime/4/18118.jpg,TV,Manga,26,Finished Airing,False,"Oct 30, 2004 to May 14, 2005","{'from': '2004-10-30', 'to': '2005-05-14'}",25 min. per ep.,G - All Ages,7.77,33244,941.0,1291,62951,1403,,Fall 2004,Unknown,"{'Adaptation': [{'mal_id': 320, 'type': 'manga', 'url': 'https://myanimelist.net/manga/320/Gakuen_Alice', 'title': 'Gakuen Alice'}]}","Aniplex, Sogo Vision",Nozomi Entertainment,Group TAC,"Comedy, School, Shoujo, Super Power","['""Pikapika no Taiyou"" by Ueda, Kana']","['""Shiawase no Niji"" by Ueda Kana & Kugimiya Rie']",25.0,2004.0,7.767701800043523,5811,0.9448446058666526,0.7958355390859362,0.061471537490060346,0.5947100552060742
33255,Saiki Kusuo no Ψ-nan (TV),The Disastrous Life of Saiki K.,斉木楠雄のΨ難,Saiki Kusuo no Psi Nan,https://myanimelist.cdn-dena.com/images/anime/11/80167.jpg,TV,Manga,120,Finished Airing,False,"Jul 4, 2016 to Dec 26, 2016","{'from': '2016-07-04', 'to': '2016-12-26'}",5 min. per ep.,PG-13 - Teens 13 or older,8.56,59498,79.0,580,144096,2969," Saiki Kusuo no &Psi;-nan aired weekly from Monday to Friday short 5 minute episodes in the morning block until November 4, 2016. A full episode every Sunday night followed the morning block short, but later became the main broadcast time. ",Summer 2016,Not scheduled once per week,"{'Adaptation': [{'mal_id': 37755, 'type': 'manga', 'url': 'https://myanimelist.net/manga/37755/Saiki_Kusuo_no_Ψ-nan', 'title': 'Saiki Kusuo no Ψ-nan'}], 'Other': [{'mal_id': 19469, 'type': 'anime', 'url': 'https://myanimelist.net/anime/19469/Saiki_Kusuo_no_Ψ-nan', 'title': 'Saiki Kusuo no Ψ-nan'}], 'Sequel': [{'mal_id': 34612, 'type': 'anime', 'url': 'https://myanimelist.net/anime/34612/Saiki_Kusuo_no_Ψ-nan_TV_2', 'title': 'Saiki Kusuo no Ψ-nan (TV) 2'}]}","TV Tokyo, Shogakukan Productions, Pony Canyon, Nippon Columbia, KlockWorx, Asmik Ace Entertainment, Bandai Namco Entertainment, Shueisha, Toy&#039;s Factory, Dear Stage inc.",Funimation,"J.C.Staff, Egg Firm","Slice of Life, Comedy, Supernatural, School, Shounen","['#1: ""Seishun wa Zankoku ja nai (青春は残酷じゃない)"" by Natsuki Hanae (eps 1-60)', '#2: ""Sai Ψ Sai Kouchou (最Ψ最好調！)"" by Dempagumi.inc (eps 61-120)']","['#1: ""Ψ desu I LIKE YOU"" by Dempagumi.inc', '#2: ""Kokoro (こころ)"" by Natsuki Hanae']",5.0,2016.0,8.557388650972369,7609,0.8405674770167773,0.8491265219692959,0.11219420927077975,0.5946231087247614
10838,Double-J,,だぶるじぇい,"Daburu Jei, Yuruani",https://myanimelist.cdn-dena.com/images/anime/11/31695.jpg,TV,Manga,11,Finished Airing,False,"Jun 29, 2011 to Sep 14, 2011","{'from': '2011-06-29', 'to': '2011-09-14'}",4 min. per ep.,PG-13 - Teens 13 or older,5.57,3998,8247.0,3793,9317,5,,Summer 2011,Unknown,"{'Adaptation': [{'mal_id': 15006, 'type': 'manga', 'url': 'https://myanimelist.net/manga/15006/Double-J', 'title': 'Double-J'}]}",,,DLE,"Comedy, School, Shounen",[],"['#1: ""Wani to Shampoo (ワニとシャンプー)"" by Momoiro Clover Z (eps 1-10)', '#2: ""Kyou no Hi wa Sayounara (今日の日はさようなら)"" by Hajime Usami (Ayuru Ohashi), Sayo Arima (Emiri Kato), Aya Chousokabe (Kanami Satou), Maria Sassa (Chiaki Omigawa), Ema Houjou (Ayana Taketatsu), Shizuma Sanada (Ryou Hirohashi), Françoise ']",4.0,2011.0,5.604985070925148,2572,0.8174026437240571,0.8517734250926416,0.13065157397446092,0.5939431221210827
3457,Vampire Knight,Vampire Knight,ヴァンパイア騎士〈ナイト〉,Vampire Kishi,https://myanimelist.cdn-dena.com/images/anime/3/7327.jpg,TV,Manga,13,Finished Airing,False,"Apr 8, 2008 to Jul 1, 2008","{'from': '2008-04-08', 'to': '2008-07-01'}",24 min. per ep.,PG-13 - Teens 13 or older,7.3,210142,2447.0,154,350090,7929,"Vampire Knight was released by Manga Entertainment in the UK and by Madman Entertainment in Australia. Vampire Knight is available for streaming on Hulu and Netflix. Additionally, the anime has been adapted into drama CDs, live-action musicals, dating simulators and art books. ",Spring 2008,Unknown,"{'Adaptation': [{'mal_id': 618, 'type': 'manga', 'url': 'https://myanimelist.net/manga/618/Vampire_Knight', 'title': 'Vampire Knight'}], 'Sequel': [{'mal_id': 4752, 'type': 'anime', 'url': 'https://myanimelist.net/anime/4752/Vampire_Knight__Guilty', 'title': 'Vampire Knight: Guilty'}], 'Side story': [{'mal_id': 8422, 'type': 'anime', 'url': 'https://myanimelist.net/anime/8422/Vampire_Knight__Gekiai_no_Portrait', 'title': 'Vampire Knight: Gekiai no Portrait'}]}","TV Tokyo, Aniplex, Nihon Ad Systems",Viz Media,Studio Deen,"Drama, Mystery, Romance, Shoujo, Supernatural, Vampire","['""Futatsu no Kodou to Akai Tsumi"" by ON/OFF']","['""still doll"" by Wakeshima Kanon']",24.0,2008.0,7.29985906156073,9094,0.8289761898310652,0.8197458973001589,0.1491276486271575,0.593290412800266
7674,Bakuman.,Bakuman.,バクマン。,Bakuman Season 1,https://myanimelist.cdn-dena.com/images/anime/6/26138.jpg,TV,Manga,25,Finished Airing,False,"Oct 2, 2010 to Apr 2, 2011","{'from': '2010-10-02', 'to': '2011-04-02'}",24 min. per ep.,PG-13 - Teens 13 or older,8.32,167429,216.0,172,332666,6846,"Bakuman. was licensed by Media Blasters in North America, but only released  one 2-disc DVD containing the first 7 episodes, the rest of the releases were cancelled. ",Fall 2010,Unknown,"{'Adaptation': [{'mal_id': 9711, 'type': 'manga', 'url': 'https://myanimelist.net/manga/9711/Bakuman', 'title': 'Bakuman.'}], 'Sequel': [{'mal_id': 10030, 'type': 'anime', 'url': 'https://myanimelist.net/anime/10030/Bakuman_2nd_Season', 'title': 'Bakuman. 2nd Season'}], 'Summary': [{'mal_id': 15711, 'type': 'anime', 'url': 'https://myanimelist.net/anime/15711/Bakuman__Deraman', 'title': 'Bakuman.: Deraman.'}]}","NHK, Shueisha","Media Blasters, NYAV Post",J.C.Staff,"Comedy, Drama, Romance, Shounen","['#1: ""Blue Bird"" by Kobukuro (eps 1-24)', '#2: ""Genjitsu to iu Na no Kaibutsu to Tatakau Mono Tachi (現実という名の怪物と戦う者たち)"" by Yuu Takahashi (高橋優) (ep 25)']","['#1: ""BAKUROCK ~Mirai no Rinkakusen~ (BAKUROCK 〜未来の輪郭線〜)"" by YA-KYIM (eps 1-13)', '#2: ""Genjitsu to iu Na no Kaibutsu to Tatakau Mono Tachi (現実という名の怪物と戦う者たち)"" by Yuu Takahashi (高橋優) (eps 14-24)', '#3: ""Blue Bird"" by Kobukuro (ep 25)']",24.0,2010.0,8.319214278248252,9020,0.9245484643425639,0.79142403388036,0.07975115767809533,0.5925888064473364
4264,Ultraviolet: Code 044,Ultraviolet: Code 044,ウルトラヴァイオレットコード044,Ultraviolet:Code044,https://myanimelist.cdn-dena.com/images/anime/5/21701.jpg,TV,Other,12,Finished Airing,False,"Jul 1, 2008 to Sep 16, 2008","{'from': '2008-07-01', 'to': '2008-09-16'}",24 min. per ep.,R - 17+ (violence & profanity),6.0,768,7362.0,5065,4540,2,,Summer 2008,Unknown,[],"Sony Pictures Entertainment, Tezuka Productions",,Madhouse,"Action, Sci-Fi","['""Guilty Pleasure"" by BECCA']","['""Falling Down"" by BECCA']",24.0,2008.0,6.1156322818562865,1677,0.785544281745653,0.903476266101994,0.10670283923476309,0.5925887177371955
1579,Kiniro no Corda: Primo Passo,La corda d&#039;oro: primo passo,金色のコルダ ～primo passo～,"Kin&#039;iro no Chord, Kiniro no Chord, Kin-iro no Corda: Primo Passo, The Golden Chord",https://myanimelist.cdn-dena.com/images/anime/9/7228.jpg,TV,Visual novel,25,Finished Airing,False,"Oct 2, 2006 to Mar 26, 2007","{'from': '2006-10-02', 'to': '2007-03-26'}",24 min. per ep.,PG-13 - Teens 13 or older,7.63,36820,1273.0,1138,72255,1126,,Fall 2006,Unknown,"{'Adaptation': [{'mal_id': 1051, 'type': 'manga', 'url': 'https://myanimelist.net/manga/1051/Kiniro_no_Corda', 'title': 'Kiniro no Corda'}], 'Side story': [{'mal_id': 3392, 'type': 'anime', 'url': 'https://myanimelist.net/anime/3392/Kiniro_no_Corda__Primo_Passo_-_Hitonatsu_no_Encore', 'title': 'Kiniro no Corda: Primo Passo - Hitonatsu no Encore'}], 'Sequel': [{'mal_id': 5717, 'type': 'anime', 'url': 'https://myanimelist.net/anime/5717/Kiniro_no_Corda__Secondo_Passo', 'title': 'Kiniro no Corda: Secondo Passo'}], 'Spin-off': [{'mal_id': 20971, 'type': 'anime', 'url': 'https://myanimelist.net/anime/20971/Kiniro_no_Corda__Blue♪Sky', 'title': 'Kiniro no Corda: Blue♪Sky'}]}","Aniplex, Hakusensha, Koei, TYO",Sentai Filmworks,Yumeta Company,"Comedy, Drama, Harem, Magic, Music, Romance, School, Shoujo","['""Brand New Breeze"" by Kanon (eps 1-24, ep 26)']","['#1: ""Crescendo"" by Stella Quintet (eps 1-24, ep 26)', '#2: ""Brand New Breeze"" by Kanon (ep 25)']",24.0,2006.0,7.628303597525765,6150,0.914431387785668,0.8138344803246869,0.06281865381916835,0.5910578922367428
33028,Danganronpa 3: The End of Kibougamine Gakuen - Zetsubou-hen,Danganronpa 3: The End of Hope&#039;s Peak High School - Despair Arc,ダンガンロンパ3 -The End of 希望ヶ峰学園- 絶望編,Danganronpa 3: The End of Hope&#039;s Peak Academy - Despair Volume,https://myanimelist.cdn-dena.com/images/anime/4/80932.jpg,TV,Game,11,Finished Airing,False,"Jul 14, 2016 to Sep 22, 2016","{'from': '2016-07-14', 'to': '2016-09-22'}",23 min. per ep.,R - 17+ (violence & profanity),7.77,59925,937.0,703,121450,1926,Danganronpa 3: The End of Kibougamine Gakuen - Zetsubou-hen is an original story following the characters of the visual novel Super Danganronpa 2: Sayonara Zetsubou Gakuen before they arrived at the island. It is a prequel to SDR2.,Summer 2016,Thursdays at 23:30 (JST),"{'Prequel': [{'mal_id': 16592, 'type': 'anime', 'url': 'https://myanimelist.net/anime/16592/Danganronpa__Kibou_no_Gakuen_to_Zetsubou_no_Koukousei_The_Animation', 'title': 'Danganronpa: Kibou no Gakuen to Zetsubou no Koukousei The Animation'}], 'Sequel': [{'mal_id': 32189, 'type': 'anime', 'url': 'https://myanimelist.net/anime/32189/Danganronpa_3__The_End_of_Kibougamine_Gakuen_-_Mirai-hen', 'title': 'Danganronpa 3: The End of Kibougamine Gakuen - Mirai-hen'}, {'mal_id': 34103, 'type': 'anime', 'url': 'https://myanimelist.net/anime/34103/Danganronpa_3__The_End_of_Kibougamine_Gakuen_-_Kibou-hen', 'title': 'Danganronpa 3: The End of Kibougamine Gakuen - Kibou-hen'}]}",,Funimation,Lerche,"Action, Mystery, Horror, Psychological, School","['""Kami-iro Awase (カミイロアワセ)"" by Binaria']","['""Zettai Kibou Birthday (絶対希望バースデー)"" by Nagito Komaeda (Megumi Ogata)']",23.0,2016.0,7.768723345616848,7256,0.8636931453136723,0.7950414681489325,0.1300247906824454,0.5902906033678665
5835,Hanasakeru Seishounen,,花咲ける青少年,Hanasakeru Seishonen,https://myanimelist.cdn-dena.com/images/anime/6/22695.jpg,TV,Manga,39,Finished Airing,False,"Apr 5, 2009 to Feb 14, 2010","{'from': '2009-04-05', 'to': '2010-02-14'}",24 min. per ep.,PG-13 - Teens 13 or older,7.87,16772,753.0,1654,44633,500,,Spring 2009,Unknown,"{'Adaptation': [{'mal_id': 5854, 'type': 'manga', 'url': 'https://myanimelist.net/manga/5854/Hanasakeru_Seishounen', 'title': 'Hanasakeru Seishounen'}], 'Summary': [{'mal_id': 6726, 'type': 'anime', 'url': 'https://myanimelist.net/anime/6726/Hanasakeru_Seishounen_Recaps', 'title': 'Hanasakeru Seishounen Recaps'}]}",,,Studio Pierrot,"Drama, Romance, Shoujo","['""Change"" by J-Min']","['""One"" by J-Min']",24.0,2009.0,7.864865387663068,5115,0.9346090248184002,0.7480148226574908,0.10070630057533093,0.5884989488569032
877,Nana,Nana,NANA [ナナ],,https://myanimelist.cdn-dena.com/images/anime/2/11232.jpg,TV,Manga,47,Finished Airing,False,"Apr 5, 2006 to Mar 28, 2007","{'from': '2006-04-05', 'to': '2007-03-28'}",23 min. per ep.,R+ - Mild Nudity,8.51,108693,101.0,262,262266,12291,"Nana was also adapted into two successful live action films in 2006, starring Mika Nakashima and Aoi Miyazaki. The manga won the Shogakukan Manga Award for shoujo and it sold more than 40 million copies to this date.",Spring 2006,Unknown,"{'Adaptation': [{'mal_id': 28, 'type': 'manga', 'url': 'https://myanimelist.net/manga/28/Nana', 'title': 'Nana'}], 'Summary': [{'mal_id': 1869, 'type': 'anime', 'url': 'https://myanimelist.net/anime/1869/Nana_Recaps', 'title': 'Nana Recaps'}]}","VAP, Nippon Television Network, Shueisha",Viz Media,Madhouse,"Music, Slice of Life, Comedy, Drama, Romance, Shoujo","['#1: ""Rose"" by Anna inspi&#039; Nana ~Black Stones~ (eps 1-21)', '#2: ""Wish"" by Olivia inspi&#039; Reira ~Trapnest~ (eps 22-36)', '#3: ""Lucy"" by Tsuchiya, Anna inspi&#039; Nana ~Black Stones~ (eps 37-47)']","['#1: ""A Little Pain"" by Olivia inspi&#039; Reira ~Trapnest~ (eps 01-08, 10-18, 41 (for TV broadcast))', '#2: ""Rose"" by Anna inspi&#039; Nana ~Black Stones~ (ep 9 (for TV broadcast and DVD))', '#3: ""Starless Night"" by Olivia inspi&#039; Reira ~Trapnest~ (eps 19-29, 42 (for TV broadcast), DVD: eps 01-08, 10-29, 41-42)', '#4: ""Kuroi Namida"" by Anna inspi&#039; Nana ~Black Stones~ (eps 30-40, 47 (for TV broadcast and DVD))', '#5: ""Winter Sleep"" by Olivia inspi&#039; Reira ~Trapnest~ (eps 43-44 (for TV broadcast and DVD))', '#6: ""Stand By Me"" by Tsuchiya, Anna inspi&#039; Nana ~Black Stones~ (eps 45-46 (for TV broadcast and DVD))']",23.0,2006.0,8.508615433168044,8668,0.8419876351407867,0.8275101464619729,0.11346648580382619,0.5883782082441733
744,Trouble Chocolate,,トラブルチョコレート,,https://myanimelist.cdn-dena.com/images/anime/8/61293.jpg,TV,Radio,20,Finished Airing,False,"Oct 8, 1999 to Mar 24, 2000","{'from': '1999-10-08', 'to': '2000-03-24'}",25 min. per ep.,G - All Ages,6.68,1184,4864.0,5719,3351,18,,Fall 1999,Saturdays at 02:00 (JST),"{'Adaptation': [{'mal_id': 4098, 'type': 'manga', 'url': 'https://myanimelist.net/manga/4098/Trouble_Chocolate__The_Comic', 'title': 'Trouble Chocolate: The Comic'}]}",Robot Communications,Viz Media,AIC,"Comedy, Romance, Sci-Fi, Shounen","['""C.H.O.C.O."" by Tange Sakura & Hikami Kyoko']","['#1: ""Nee Nani de... (ねぇ 何で...)"" by Rie Yoshizawa (eps 1-12)', '#2: ""Anata ni Aitakute: Missing You (あなたに逢いたくて~Missing You~)"" by Sakura Tenge, Kyouko Hikami (eps 13-20)']",25.0,1999.0,6.705209361877926,1342,0.7985664107503851,0.8459502382212811,0.1269937789419524,0.5845984412114942
36847,Nanatsu no Bitoku,The Seven Heavenly Virtues,七つの美徳,,https://myanimelist.cdn-dena.com/images/anime/9/89129.jpg,TV,Other,10,Finished Airing,False,"Jan 27, 2018 to Mar 31, 2018","{'from': '2018-01-27', 'to': '2018-03-31'}",5 min. per ep.,R+ - Mild Nudity,5.2,4722,8835.0,2533,22001,47,,Winter 2018,Saturdays at 00:25 (JST),"{'Other': [{'mal_id': 33834, 'type': 'anime', 'url': 'https://myanimelist.net/anime/33834/Sin__Nanatsu_no_Taizai', 'title': 'Sin: Nanatsu no Taizai'}], 'Side story': [{'mal_id': 37172, 'type': 'anime', 'url': 'https://myanimelist.net/anime/37172/Nanatsu_no_Bitoku_Specials', 'title': 'Nanatsu no Bitoku Specials'}]}",Hobby Japan,Sentai Filmworks,Bridge,"Ecchi, Fantasy","['""Psychomachia"" by Yousei Teikoku']",[],5.0,2018.0,5.237405396236262,3837,0.904193971357937,0.8005999647079584,0.05679405023621311,0.5813240354796959
