anime_id,title,title_english,title_japanese,title_synonyms,image_url,type,source,episodes,status,airing,aired_string,aired,duration,rating,score,scored_by,rank,popularity_rank,members,favorites,background,premiered,broadcast,related,producer,licensor,studio,genre,opening_theme,ending_theme,duration_min,aired_from_year,weighted_avg,popularity_score,normalized_weight,normalized_popularity,normalized_fav,final_score
3335,Haikara-san ga Tooru,Smart-san,はいからさんが通る,"Here Comes Ms. Modern, Mademoiselle Anne, Haikara-san Passes, Comes Miss High-Collar, Haikara-san ga Toru",https://myanimelist.cdn-dena.com/images/anime/2/22741.jpg,TV,Manga,42,Finished Airing,False,"Jun 3, 1978 to Mar 31, 1979","{'from': '1978-06-03', 'to': '1979-03-31'}",24 min. per ep.,PG-13 - Teens 13 or older,7.37,318,2149.0,6820,2036,7,,Summer 1978,Unknown,"{'Adaptation': [{'mal_id': 1567, 'type': 'manga', 'url': 'https://myanimelist.net/manga/1567/Haikara-san_ga_Tooru', 'title': 'Haikara-san ga Tooru'}], 'Other': [{'mal_id': 33378, 'type': 'anime', 'url': 'https://myanimelist.net/anime/33378/Haikara-san_ga_Tooru_Movie_1__Benio_Hana_no_17-sai', 'title': 'Haikara-san ga Tooru Movie 1: Benio, Hana no 17-sai'}], 'Alternative version': [{'mal_id': 35228, 'type': 'anime', 'url': 'https://myanimelist.net/anime/35228/Haikara-san_ga_Tooru_Movie_2__Tokyo_Dai_Roman', 'title': 'Haikara-san ga Tooru Movie 2: Tokyo Dai Roman'}]}",Asahi Broadcasting,,Nippon Animation,"Slice of Life, Romance, Historical, Drama, Shoujo","['""Haikara-san ga Tooru (はいからさんが通る)"" by Shousuke Sekita']","['""Gokigen Ikaga? Benio Desu (ごきげんいかが?紅緒です)"" by Shousuke Sekita']",24.0,1978.0,7.282365599644155,868,0.8826064325495893,0.8789482971589907,0.19663220917723,0.6462016898323174
12445,Tasogare Otome x Amnesia,Dusk Maiden of Amnesia,黄昏乙女×アムネジア,Tasogare Otome x Amnesia,https://myanimelist.cdn-dena.com/images/anime/12/64435.jpg,TV,Manga,12,Finished Airing,False,"Apr 9, 2012 to Jun 25, 2012","{'from': '2012-04-09', 'to': '2012-06-25'}",23 min. per ep.,R - 17+ (violence & profanity),7.93,111160,644.0,317,226392,3060,,Spring 2012,Unknown,"{'Adaptation': [{'mal_id': 15805, 'type': 'manga', 'url': 'https://myanimelist.net/manga/15805/Tasogare_Otome_x_Amnesia', 'title': 'Tasogare Otome x Amnesia'}], 'Sequel': [{'mal_id': 14189, 'type': 'anime', 'url': 'https://myanimelist.net/anime/14189/Tasogare_Otome_x_Amnesia__Taima_Otome', 'title': 'Tasogare Otome x Amnesia: Taima Otome'}]}","Square Enix, Media Factory, Tasogare Otome×Amnesia Production Partners",Sentai Filmworks,Silver Link.,"Horror, Mystery, Romance, School, Shounen, Supernatural","['""CHOIR JAIL (クワイア ジェイル)"" by Konomi Suzuki']","['#1: ""CHOIR JAIL (クワイア ジェイル)"" by Konomi Suzuki (eps 1, 12)', '#2: ""Calendrier (カランドリエ)"" by Aki Okui (eps 2-10)', '#3: ""Calendrier -Yuuko- (カランドリエ ―夕子―)"" by Yumi Hara (ep 11)']",23.0,2012.0,7.929167435022929,8468,0.8463912118314358,0.8978295394388566,0.20454651761073953,0.6430931987307406
2559,Romeo no Aoi Sora,Romeo and the Black Brothers,ロミオの青い空,"Sekai Meisaku Gekijou, Romeo&#039;s Blue Skies, Romio no Aoi Sora",https://myanimelist.cdn-dena.com/images/anime/4/17979.jpg,TV,Novel,33,Finished Airing,False,"Jan 15, 1995 to Dec 17, 1995","{'from': '1995-01-15', 'to': '1995-12-17'}",23 min. per ep.,PG-13 - Teens 13 or older,8.45,7943,134.0,2528,22086,318,Romeo no Aoi Sora is based on the 1941 German novel Die schwarzen Br&uuml;der by Lisa Tetzner.,Winter 1995,Sundays at 19:30 (JST),"{'Summary': [{'mal_id': 23581, 'type': 'anime', 'url': 'https://myanimelist.net/anime/23581/Romeo_no_Aoi_Sora_Specials', 'title': 'Romeo no Aoi Sora Specials'}]}",,,Nippon Animation,"Adventure, Drama, Historical, Slice of Life","['""Sora e..."" by Hiroko Kasahara']","['""Si Si Ciao -Romana no Oka de-"" by Hiroko Kasahara']",23.0,1995.0,8.432017757136796,3846,0.8406031237891227,0.9348861831656962,0.17307638336685535,0.6430266778061525
2618,Takarajima,,宝島,Treasure Island,https://myanimelist.cdn-dena.com/images/anime/11/56123.jpg,TV,Novel,26,Finished Airing,False,"Oct 8, 1978 to Apr 1, 1979","{'from': '1978-10-08', 'to': '1979-04-01'}",24 min. per ep.,PG-13 - Teens 13 or older,8.09,3201,450.0,3959,8376,114,"This is an anime adaptation of the classic novel ""Treasure Island"" written by Scottish novelist Robert Louis Stevenson in 1882.",Fall 1978,Sundays at Unknown,"{'Side story': [{'mal_id': 11685, 'type': 'anime', 'url': 'https://myanimelist.net/anime/11685/Takarajima_Memorial__Yuunagi_to_Yobareta_Otoko', 'title': 'Takarajima Memorial: Yuunagi to Yobareta Otoko'}], 'Alternative version': [{'mal_id': 21255, 'type': 'anime', 'url': 'https://myanimelist.net/anime/21255/Takarajima_Movie', 'title': 'Takarajima (Movie)'}]}",Tokyo Movie Shinsha,,"Madhouse, TMS Entertainment","Adventure, Mystery, Historical, Drama","['""Takarajima"" by Machida Yoshito (町田よしと)']","['""Chiisana Funanori (小さな船乗り)"" by Machida Yoshito (町田よしと)']",24.0,1978.0,8.057091433096412,2431,0.8681125676116148,0.8515087347803071,0.2251929463492212,0.6417887020845773
24031,Denki-gai no Honya-san,Denki-gai,デンキ街の本屋さん,"Denki Machi no Honya-san, Denkigai no Honya-san",https://myanimelist.cdn-dena.com/images/anime/2/65339.jpg,TV,Manga,12,Finished Airing,False,"Oct 2, 2014 to Dec 18, 2014","{'from': '2014-10-02', 'to': '2014-12-18'}",23 min. per ep.,PG-13 - Teens 13 or older,7.27,34590,2517.0,1035,80620,210,"The first half of Episode 1 was streamed in advance as a preview on September 23, 2014. on Niconico Live. Regular broadcasting began on October 2, 2014. ",Fall 2014,Thursdays at 22:30 (JST),"{'Adaptation': [{'mal_id': 42289, 'type': 'manga', 'url': 'https://myanimelist.net/manga/42289/Denki-gai_no_Honya-san', 'title': 'Denki-gai no Honya-san'}]}","Sotsu, Pony Canyon, DAX Production, Comic Umenohone, Mobcast",Ponycan USA,Shin-Ei Animation,"Comedy, Seinen, Slice of Life","['""Kajirikake no Ringo (齧りかけの林檎)"" by Ayana Taketatsu']","['""two-Dimension&#039;s Love"" by denk!girls (Natsumi Takamori, Minami Tsuda, Ayana Taketatsu, Mai Aizawa)']",23.0,2014.0,7.269232309618081,6398,0.8942017399466995,0.8795659078877713,0.14933345806632678,0.6346233649472632
249,InuYasha,InuYasha,犬夜叉,Inu Yasha,https://myanimelist.cdn-dena.com/images/anime/8/20483.jpg,TV,Manga,167,Finished Airing,False,"Oct 16, 2000 to Sep 13, 2004","{'from': '2000-10-16', 'to': '2004-09-13'}",24 min. per ep.,PG-13 - Teens 13 or older,7.9,181978,697.0,141,371313,12282,"The anime won the &ldquo;Property of the Year&rdquo; award in ICv2&rsquo;s Anime Awards for both 2004 and 2005, and received third place in Animage&rsquo;s Anime Grand Prix &ldquo;Best Anime&rdquo; category in 2003.",Fall 2000,Mondays at 19:00 (JST),"{'Adaptation': [{'mal_id': 676, 'type': 'manga', 'url': 'https://myanimelist.net/manga/676/InuYasha', 'title': 'InuYasha'}], 'Side story': [{'mal_id': 449, 'type': 'anime', 'url': 'https://myanimelist.net/anime/449/InuYasha__Guren_no_Houraijima', 'title': 'InuYasha: Guren no Houraijima'}, {'mal_id': 450, 'type': 'anime', 'url': 'https://myanimelist.net/anime/450/InuYasha__Kagami_no_Naka_no_Mugenjo', 'title': 'InuYasha: Kagami no Naka no Mugenjo'}, {'mal_id': 451, 'type': 'anime', 'url': 'https://myanimelist.net/anime/451/InuYasha__Tenka_Hadou_no_Ken', 'title': 'InuYasha: Tenka Hadou no Ken'}, {'mal_id': 452, 'type': 'anime', 'url': 'https://myanimelist.net/anime/452/InuYasha__Toki_wo_Koeru_Omoi', 'title': 'InuYasha: Toki wo Koeru Omoi'}, {'mal_id': 4886, 'type': 'anime', 'url': 'https://myanimelist.net/anime/4886/InuYasha__Kuroi_Tessaiga', 'title': 'InuYasha: Kuroi Tessaiga'}], 'Sequel': [{'mal_id': 6811, 'type': 'anime', 'url': 'https://myanimelist.net/anime/6811/InuYasha__Kanketsu-hen', 'title': 'InuYasha: Kanketsu-hen'}], 'Other': [{'mal_id': 31133, 'type': 'anime', 'url': 'https://myanimelist.net/anime/31133/Shounen_Sunday_CM_Gekijou__InuYasha-hen', 'title': 'Shounen Sunday CM Gekijou: InuYasha-hen'}]}","Yomiuri Telecasting, Shogakukan",Viz Media,Sunrise,"Action, Adventure, Comedy, Historical, Demons, Supernatural, Magic, Romance, Fantasy, Shounen","['#1: ""Change the World"" by V6 (eps 01-34)', '#2: ""I Am"" by Hitomi (eps 35-64)', '#3: ""Owarinai Yume"" by Nanase Aikawa (eps 65-95)', '#4: ""Grip!"" by Every Little Thing (eps 96-127)', '#5: ""One Day, One Dream"" by Tackey & Tsubasa (eps 128-153)', '#6: ""Angelus"" by Hitomi Shimatani (eps 154-167)']","['#1: ""My Will"" by Dream (eps 01-20,166-167)', '#2: ""Fukai Mori"" by Do As Infinity (eps 21-41)', '#3: ""Dearest"" by Ayumi Hamasaki (eps 42-60)', '#4: ""Every Heart - Minna no Kimochi"" by BoA (eps 61-85)', '#5: ""Shinjitsu no Uta"" by Do As Infinity (eps 86-108)', '#6: ""Itazurana Kiss"" by day after tomorrow (eps 109-127)', '#7: ""Come"" by Namie Amuro (eps 128-148)', '#8: ""Brand-New World"" by V6 (eps 149-165)']",24.0,2000.0,7.899507731964604,9176,0.9259662529049217,0.8204517381330511,0.16827728144440807,0.6318494399191857
32983,Natsume Yuujinchou Go,Natsume&#039;s Book of Friends Season 5,夏目友人帳 伍,"Natsume Yuujinchou Season 5, Natsume&#039;s Book of Friends Five",https://myanimelist.cdn-dena.com/images/anime/11/81755.jpg,TV,Manga,11,Finished Airing,False,"Oct 5, 2016 to Dec 21, 2016","{'from': '2016-10-05', 'to': '2016-12-21'}",23 min. per ep.,PG-13 - Teens 13 or older,8.64,31558,63.0,1038,80448,459,,Fall 2016,Wednesdays at 01:35 (JST),"{'Adaptation': [{'mal_id': 1859, 'type': 'manga', 'url': 'https://myanimelist.net/manga/1859/Natsume_Yuujinchou', 'title': 'Natsume Yuujinchou'}], 'Prequel': [{'mal_id': 11665, 'type': 'anime', 'url': 'https://myanimelist.net/anime/11665/Natsume_Yuujinchou_Shi', 'title': 'Natsume Yuujinchou Shi'}], 'Side story': [{'mal_id': 34534, 'type': 'anime', 'url': 'https://myanimelist.net/anime/34534/Natsume_Yuujinchou_Go_Specials', 'title': 'Natsume Yuujinchou Go Specials'}], 'Sequel': [{'mal_id': 34591, 'type': 'anime', 'url': 'https://myanimelist.net/anime/34591/Natsume_Yuujinchou_Roku', 'title': 'Natsume Yuujinchou Roku'}]}","TV Tokyo, Aniplex, Nihon Ad Systems, Hakusensha",,Shuka,"Slice of Life, Supernatural, Drama, Fantasy, Shoujo","['""Takarabako (タカラバコ)"" by Sasanomaly (ササノマリイ)']","['""Akane Sasu (茜さす)"" by Aimer']",23.0,2016.0,8.63483128500383,6386,0.863771407727083,0.8501852832186343,0.19921418214135367,0.6313463881187334
20057,Space☆Dandy,Space Dandy,スペース☆ダンディ,,https://myanimelist.cdn-dena.com/images/anime/4/56611.jpg,TV,Original,13,Finished Airing,False,"Jan 5, 2014 to Mar 27, 2014","{'from': '2014-01-05', 'to': '2014-03-27'}",24 min. per ep.,PG-13 - Teens 13 or older,7.88,75431,748.0,468,171855,2868,"Space☆Dandy reunites a number of lead production staff members from Cowboy Bebop, including producer Masahiko Minami and director Shinichiro Watanabe. Its production involved as many as 70 animation creators and 20 musical artists as collaborators, with Watanabe insisting that artists could only use pre-1984 musical styles. Although character designer Yoshiyuki Itou is credited as an animation director, his designs were not standardized across the series, allowing for individual animators to express their style. The series was licensed in North America by Funimation.  Due to licensing issues, their initial simulcast used the instrumental track Cosmic Adventure by jazz band Mountain Mocha Kilimanjaro as the opening song. Viva Namida was used from the 8th episode onwards.",Winter 2014,Unknown,"{'Adaptation': [{'mal_id': 64217, 'type': 'manga', 'url': 'https://myanimelist.net/manga/64217/Space☆Dandy', 'title': 'Space☆Dandy'}], 'Other': [{'mal_id': 20613, 'type': 'anime', 'url': 'https://myanimelist.net/anime/20613/Viva_Namida', 'title': 'Viva Namida'}, {'mal_id': 25635, 'type': 'anime', 'url': 'https://myanimelist.net/anime/25635/Space☆Dandy_Picture_Drama', 'title': 'Space☆Dandy Picture Drama'}], 'Sequel': [{'mal_id': 23327, 'type': 'anime', 'url': 'https://myanimelist.net/anime/23327/Space☆Dandy_2nd_Season', 'title': 'Space☆Dandy 2nd Season'}]}","Bandai Visual, flying DOG, Bandai Namco Entertainment",Funimation,Bones,"Sci-Fi, Space, Comedy","['""Viva Namida (ビバナミダ)"" by Yasuyuki Okamura']","['""X Jigen e Youkoso (X次元へようこそ)"" by Etsuko Yakushimaru']",24.0,2014.0,7.878839798501956,7947,0.8985399233251004,0.870389977060173,0.14401047757144864,0.6312703247257182
21,One Piece,One Piece,ONE PIECE,OP,https://myanimelist.cdn-dena.com/images/anime/6/73245.jpg,TV,Manga,0,Currently Airing,True,"Oct 20, 1999 to ?","{'from': '1999-10-20', 'to': None}",24 min.,PG-13 - Teens 13 or older,8.54,423868,91.0,35,720133,69760,"Several anime-original arcs have been adapted into light novels, and the series has inspired 40 video games as of 2016.",Fall 1999,Sundays at 09:30 (JST),"{'Adaptation': [{'mal_id': 13, 'type': 'manga', 'url': 'https://myanimelist.net/manga/13/One_Piece', 'title': 'One Piece'}, {'mal_id': 94534, 'type': 'manga', 'url': 'https://myanimelist.net/manga/94534/One_Piece__Loguetown-hen', 'title': 'One Piece: Loguetown-hen'}], 'Side story': [{'mal_id': 459, 'type': 'anime', 'url': 'https://myanimelist.net/anime/459/One_Piece_Movie_1', 'title': 'One Piece Movie 1'}, {'mal_id': 460, 'type': 'anime', 'url': 'https://myanimelist.net/anime/460/One_Piece_Movie_2__Nejimaki-jima_no_Daibouken', 'title': 'One Piece Movie 2: Nejimaki-jima no Daibouken'}, {'mal_id': 461, 'type': 'anime', 'url': 'https://myanimelist.net/anime/461/One_Piece_Movie_3__Chinjuu-jima_no_Chopper_Oukoku', 'title': 'One Piece Movie 3: Chinjuu-jima no Chopper Oukoku'}, {'mal_id': 462, 'type': 'anime', 'url': 'https://myanimelist.net/anime/462/One_Piece_Movie_4__Dead_End_no_Bouken', 'title': 'One Piece Movie 4: Dead End no Bouken'}, {'mal_id': 463, 'type': 'anime', 'url': 'https://myanimelist.net/anime/463/One_Piece_Movie_5__Norowareta_Seiken', 'title': 'One Piece Movie 5: Norowareta Seiken'}, {'mal_id': 464, 'type': 'anime', 'url': 'https://myanimelist.net/anime/464/One_Piece_Movie_6__Omatsuri_Danshaku_to_Himitsu_no_Shima', 'title': 'One Piece Movie 6: Omatsuri Danshaku to Himitsu no Shima'}, {'mal_id': 465, 'type': 'anime', 'url': 'https://myanimelist.net/anime/465/One_Piece_Movie_7__Karakuri-jou_no_Mecha_Kyohei', 'title': 'One Piece Movie 7: Karakuri-jou no Mecha Kyohei'}, {'mal_id': 466, 'type': 'anime', 'url': 'https://myanimelist.net/anime/466/One_Piece__Taose_Kaizoku_Ganzack', 'title': 'One Piece: Taose! Kaizoku Ganzack'}, {'mal_id': 1094, 'type': 'anime', 'url': 'https://myanimelist.net/anime/1094/One_Piece__Umi_no_Heso_no_Daibouken-hen', 'title': 'One Piece: Umi no Heso no Daibouken-hen'}, {'mal_id': 1237, 'type': 'anime', 'url': 'https://myanimelist.net/anime/1237/One_Piece__Oounabara_ni_Hirake_Dekkai_Dekkai_Chichi_no_Yume', 'title': 'One Piece: Oounabara ni Hirake! Dekkai Dekkai Chichi no Yume!'}, {'mal_id': 1238, 'type': 'anime', 'url': 'https://myanimelist.net/anime/1238/One_Piece__Mamore_Saigo_no_Dai_Butai', 'title': 'One Piece: Mamore! Saigo no Dai Butai'}, {'mal_id': 2020, 'type': 'anime', 'url': 'https://myanimelist.net/anime/2020/One_Piece__Nenmatsu_Tokubetsu_Kikaku_Mugiwara_no_Luffy_Oyabun_Torimonochou', 'title': 'One Piece: Nenmatsu Tokubetsu Kikaku! Mugiwara no Luffy Oyabun Torimonochou'}, {'mal_id': 2385, 'type': 'anime', 'url': 'https://myanimelist.net/anime/2385/One_Piece__Jango_no_Dance_Carnival', 'title': 'One Piece: Jango no Dance Carnival'}, {'mal_id': 2386, 'type': 'anime', 'url': 'https://myanimelist.net/anime/2386/One_Piece__Yume_no_Soccer_Ou', 'title': 'One Piece: Yume no Soccer Ou!'}, {'mal_id': 2490, 'type': 'anime', 'url': 'https://myanimelist.net/anime/2490/One_Piece__Mezase_Kaizoku_Yakyuu_Ou', 'title': 'One Piece: Mezase! Kaizoku Yakyuu Ou'}, {'mal_id': 2680, 'type': 'anime', 'url': 'https://myanimelist.net/anime/2680/One_Piece__Straw_Hat_Theater', 'title': 'One Piece: Straw Hat Theater'}, {'mal_id': 4155, 'type': 'anime', 'url': 'https://myanimelist.net/anime/4155/One_Piece_Film__Strong_World', 'title': 'One Piece Film: Strong World'}, {'mal_id': 5252, 'type': 'anime', 'url': 'https://myanimelist.net/anime/5252/One_Piece__Romance_Dawn_Story', 'title': 'One Piece: Romance Dawn Story'}, {'mal_id': 8740, 'type': 'anime', 'url': 'https://myanimelist.net/anime/8740/One_Piece_Film__Strong_World_Episode_0', 'title': 'One Piece Film: Strong World Episode 0'}, {'mal_id': 9999, 'type': 'anime', 'url': 'https://myanimelist.net/anime/9999/One_Piece_3D__Mugiwara_Chase', 'title': 'One Piece 3D: Mugiwara Chase'}, {'mal_id': 12001, 'type': 'anime', 'url': 'https://myanimelist.net/anime/12001/One_Piece_3D__Gekisou_Trap_Coaster', 'title': 'One Piece 3D: Gekisou! Trap Coaster'}, {'mal_id': 12859, 'type': 'anime', 'url': 'https://myanimelist.net/anime/12859/One_Piece_Film__Z', 'title': 'One Piece Film: Z'}, {'mal_id': 16239, 'type': 'anime', 'url': 'https://myanimelist.net/anime/16239/One_Piece__Episode_of_Luffy_-_Hand_Island_no_Bouken', 'title': 'One Piece: Episode of Luffy - Hand Island no Bouken'}, {'mal_id': 16287, 'type': 'anime', 'url': 'https://myanimelist.net/anime/16287/One_Piece__Romance_Dawn', 'title': 'One Piece: Romance Dawn'}, {'mal_id': 16468, 'type': 'anime', 'url': 'https://myanimelist.net/anime/16468/One_Piece__Glorious_Island', 'title': 'One Piece: Glorious Island'}, {'mal_id': 25161, 'type': 'anime', 'url': 'https://myanimelist.net/anime/25161/One_Piece_3D2Y__Ace_no_shi_wo_Koete_Luffy_Nakama_Tono_Chikai', 'title': 'One Piece 3D2Y: Ace no shi wo Koete! Luffy Nakama Tono Chikai'}, {'mal_id': 31490, 'type': 'anime', 'url': 'https://myanimelist.net/anime/31490/One_Piece_Film__Gold', 'title': 'One Piece Film: Gold'}, {'mal_id': 32051, 'type': 'anime', 'url': 'https://myanimelist.net/anime/32051/One_Piece__Adventure_of_Nebulandia', 'title': 'One Piece: Adventure of Nebulandia'}], 'Character': [{'mal_id': 813, 'type': 'anime', 'url': 'https://myanimelist.net/anime/813/Dragon_Ball_Z', 'title': 'Dragon Ball Z'}, {'mal_id': 10033, 'type': 'anime', 'url': 'https://myanimelist.net/anime/10033/Toriko', 'title': 'Toriko'}, {'mal_id': 23933, 'type': 'anime', 'url': 'https://myanimelist.net/anime/23933/Kyutai_Panic_Adventure', 'title': 'Kyutai Panic Adventure!'}, {'mal_id': 23935, 'type': 'anime', 'url': 'https://myanimelist.net/anime/23935/Kyutai_Panic_Adventure_Returns', 'title': 'Kyutai Panic Adventure Returns!'}], 'Summary': [{'mal_id': 2107, 'type': 'anime', 'url': 'https://myanimelist.net/anime/2107/One_Piece_Movie_8__Episode_of_Alabasta_-_Sabaku_no_Oujo_to_Kaizoku-tachi', 'title': 'One Piece Movie 8: Episode of Alabasta - Sabaku no Oujo to Kaizoku-tachi'}, {'mal_id': 8171, 'type': 'anime', 'url': 'https://myanimelist.net/anime/8171/One_Piece_Recap', 'title': 'One Piece Recap'}, {'mal_id': 15323, 'type': 'anime', 'url': 'https://myanimelist.net/anime/15323/One_Piece__Episode_of_Nami_-_Koukaishi_no_Namida_to_Nakama_no_Kizuna', 'title': 'One Piece: Episode of Nami - Koukaishi no Namida to Nakama no Kizuna'}, {'mal_id': 19123, 'type': 'anime', 'url': 'https://myanimelist.net/anime/19123/One_Piece__Episode_of_Merry_-_Mou_Hitori_no_Nakama_no_Monogatari', 'title': 'One Piece: Episode of Merry - Mou Hitori no Nakama no Monogatari'}, {'mal_id': 31289, 'type': 'anime', 'url': 'https://myanimelist.net/anime/31289/One_Piece__Episode_of_Sabo_-_3_Kyoudai_no_Kizuna_Kiseki_no_Saikai_to_Uketsugareru_Ishi', 'title': 'One Piece: Episode of Sabo - 3 Kyoudai no Kizuna Kiseki no Saikai to Uketsugareru Ishi'}, {'mal_id': 32437, 'type': 'anime', 'url': 'https://myanimelist.net/anime/32437/One_Piece__Long_Ring_Long_Land-hen', 'title': 'One Piece: Long Ring Long Land-hen'}, {'mal_id': 36215, 'type': 'anime', 'url': 'https://myanimelist.net/anime/36215/One_Piece__Episode_of_East_Blue_-_Luffy_to_4-nin_no_Nakama_no_Daibouken', 'title': 'One Piece: Episode of East Blue - Luffy to 4-nin no Nakama no Daibouken'}], 'Alternative version': [{'mal_id': 3848, 'type': 'anime', 'url': 'https://myanimelist.net/anime/3848/One_Piece_Movie_9__Episode_of_Chopper_Plus_-_Fuyu_ni_Saku_Kiseki_no_Sakura', 'title': 'One Piece Movie 9: Episode of Chopper Plus - Fuyu ni Saku, Kiseki no Sakura'}], 'Other': [{'mal_id': 34165, 'type': 'anime', 'url': 'https://myanimelist.net/anime/34165/Oishi-sa_Hajikeru_One_Piece', 'title': 'Oishi-sa Hajikeru! One Piece'}, {'mal_id': 36239, 'type': 'anime', 'url': 'https://myanimelist.net/anime/36239/Sono_Me_ga_Mitsumeru_Mono', 'title': 'Sono Me ga Mitsumeru Mono'}]}","Fuji TV, TAP, Shueisha","Funimation, 4Kids Entertainment",Toei Animation,"Action, Adventure, Comedy, Super Power, Drama, Fantasy, Shounen","['#01: ""We Are! (ウィーアー!)"" by Hiroshi Kitadani (eps 1-47)', '#02: ""Believe"" by Folder5 (eps 48-115)', '#03: ""Hikari E (ヒカリヘ)"" by The Babystars (eps 116-168)', '#04: ""Bon Voyage!"" by Bon-Bon Blanco (eps 169-206)', '#05: ""Kokoro no Chizu (ココロのちず)"" by BOYSTYLE (eps 207-263)', '#06: ""Brand New World"" by D-51 (eps 264-278)', '#07: ""We Are! (ウィーアー! 〜7人の麦わら海賊団篇〜)"" by the Straw Hat Pirates (eps 279-283)', '#08: ""Crazy Rainbow"" by Tackey & Tsubasa (eps 284-325)', '#09: ""Jungle P"" by 5050 (eps 326-372)', '#10: ""We Are (ウィーアー! 〜10周年Ver.〜)"" by TVXQ (eps 373-394)', '#11: ""Share the World"" by TVXQ (eps 395-425)', '#12: ""Kaze wo Sagashite (風をさがして)"" by Straw Hat Crew and Mari Yaguchi (eps 426-458)', '#13: ""One Day"" by The Rootless (eps 459-491)', '#14: ""Fight Together"" by Namie Amuro (eps 493-516)', '#15: ""We go! (ウィーゴー!)"" by Hiroshi Kitadani (eps 517-541, 543-589)', '#16: ""Hands Up!"" by Kouta Shinzato (eps 591-628)', '#17: ""Wake up!"" by AAA (eps 629-686)', '#18: ""Hard Knock Days"" by GENERATIONS from EXILE TRIBE (eps 687-746)', '#19: ""We can! (ウィーキャン!)"" by Kishidan and Hiroshi Kitadani (eps 747-806)', '#20 ""Hope"" by Namie Amuro (eps 807-)']","['#01: ""memories"" by Maki Otsuki (eps 1-30)', '#02: ""RUN! RUN! RUN!"" by Maki Otsuki (eps 31-63)', '#03: ""Watashi ga iru Yo (私がいるよ)"" by TOMATO CUBE (eps 64-73)', '#04: ""Souchinosuke (しょうちのすけ)"" by Suitei-Shoujo (eps 74-81)', '#05: ""BEFORE DAWN"" by AI-SACHI (eps 82-94)', '#06: ""fish"" by The Kaleidoscope (eps 95-106)', '#07: ""GLORY -Kimi ga iru Kara- (GLORY-君がいるから-)"" by Takako Uehara (eps 107-118)', '#08: ""Shining ray"" by Janne da Arc (eps 119-127, 129-132)', '#09: ""Family"" by the Straw Hat Pirates (ep 128)', '#10: ""Free Will"" by Ruppina (eps 133-156)', '#11: ""FAITH"" by Ruppina (eps 157-168)', '#12: ""A to Z ~One Piece Edition~ (A to Z〜ONE PIECE Edition〜)"" by ZZ (eps 169-181)', '#13: ""Tsuki to Taiyou (月と太陽)"" by shela (eps 182-195)', '#14: ""DREAMSHIP"" by Aiko Ikuta (eps 196-206)', '#15: ""Mirai Koukai (未来航海)"" by Tackey & Tsubasa (eps 207-230)', '#16: ""Eternal Pose (エターナルポーズ)"" by Asia Engineer (eps 231-245)', '#17: ""Dear friends"" by TRIPLANE (eps 246-255)', '#18: ""Asu wa Kurukara (明日は来るから)"" by Dong Bang Shin Gi (eps 256-263)', '#19: ""ADVENTURE WORLD"" by Delicatessen (eps 264-278)', '#20: ""One Day"" by The Rootless (ep 492)', '#21: ""We go! (ウィーゴー!)"" by Hiroshi Kitadani (eps 542, 590)']",24.0,1999.0,8.539637634964553,10105,0.9289626470598131,0.8667725427916005,0.10918190747930212,0.6286226421191362
233,Daa! Daa! Daa!,,だぁ! だぁ! だぁ!,"Da!Da!Da!, UFO Baby",https://myanimelist.cdn-dena.com/images/anime/3/21166.jpg,TV,Manga,78,Finished Airing,False,"Mar 28, 2000 to Feb 26, 2002","{'from': '2000-03-28', 'to': '2002-02-26'}",25 min. per ep.,G - All Ages,7.78,6598,919.0,3045,15211,216,,Spring 2000,Tuesdays at 18:00 (JST),"{'Adaptation': [{'mal_id': 1526, 'type': 'manga', 'url': 'https://myanimelist.net/manga/1526/Daa_Daa_Daa', 'title': 'Daa! Daa! Daa!'}]}",,,J.C.Staff,"Comedy, Sci-Fi, Shoujo","['#1: ""Heart no Tsubasa (ハートのつばさ)"" by Reika Nakajima (eps 1-39)', '#2: ""Happy Flower"" by Saori Nara (eps 40-78)']","['#1: ""Boy Meets Girl DA!DA!DA! Remix"" by TRF (eps 1-38)', '#2: ""Heart no Tsubasa (Miyu Version) (ハートのつばさ(未夢ヴァージョン))"" by Kaori Nazuka (ep 39)', '#3: ""Yukkuri (ゆっくり)"" by Hitomi Mieno (eps 40-78)']",25.0,2000.0,7.768409797051547,3275,0.9186856837272728,0.8027174872066349,0.16276720145937604,0.6217762228897836
