anime_id,title,title_english,title_japanese,title_synonyms,image_url,type,source,episodes,status,airing,aired_string,aired,duration,rating,score,scored_by,rank,popularity_rank,members,favorites,background,premiered,broadcast,related,producer,licensor,studio,genre,opening_theme,ending_theme,duration_min,aired_from_year,weighted_avg,popularity_score,normalized_weight,normalized_popularity,normalized_fav,final_score
11013,Inu x Boku SS,Inu X Boku Secret Service,妖狐×僕SS,Youko x Boku SS,https://myanimelist.cdn-dena.com/images/anime/12/35893.jpg,TV,Manga,12,Finished Airing,False,"Jan 13, 2012 to Mar 30, 2012","{'from': '2012-01-13', 'to': '2012-03-30'}",24 min. per ep.,PG-13 - Teens 13 or older,7.63,139250,1274.0,231,283882,2809,"Inu x Boku SS was licensed by Sentai Filmworks for North America, while MVM Films licensed it for the United Kingdom. During April 2013, Hanabee Entertainment released the series on DVD and Blu-ray for Australia and New Zealand.",Winter 2012,Fridays at Unknown,"{'Adaptation': [{'mal_id': 17207, 'type': 'manga', 'url': 'https://myanimelist.net/manga/17207/Inu_x_Boku_SS', 'title': 'Inu x Boku SS'}], 'Sequel': [{'mal_id': 13403, 'type': 'anime', 'url': 'https://myanimelist.net/anime/13403/Inu_x_Boku_SS_Special', 'title': 'Inu x Boku SS Special'}]}","Aniplex, Square Enix, Mainichi Broadcasting System, Movic, Inu x Boku SS Production Partners",Sentai Filmworks,David Production,"Comedy, Supernatural, Romance, Shounen","['""Nirvana"" by MUCC']","['#1: ""Nirvana"" by MUCC (eps 1, 11-12)', '#2: ""Rakuen no Photograph (楽園のPhotograph)"" by Soushi Miketsukami (Yuichi Nakamura) (eps 2, 9)', '#3: ""Kimi wa (君は)"" by Ririchiyo Shirakiin (Rina Hidaka) (eps 3, 8)', '#4: ""one way"" by Banri Watanuki (Takuya Eguchi) & Zange Natsume (Mamoru Miyano) (ep 4)', '#5: ""SM Hantei Forum (SM判定フォーラム)"" by Kagerou Shoukiin (Tomokazu Sugita) (ep 5, 10)', '#6: ""sweets parade"" by Karuta Roromiya (Kana Hanazawa) (ep 6)', '#7: ""Taiyou to Tsuki (太陽と月)"" by Renshou Sorinozuka (Yoshimasa Hosoya) & Nobara Yukinokouji (Youko Hikasa) (ep 7)']",24.0,2012.0,7.629550547690356,8775,1.0,0.9722957473089818,1.0,0.9808575966119641
12365,Bakuman. 3rd Season,Bakuman.,バクマン。,Bakuman Season 3,https://myanimelist.cdn-dena.com/images/anime/6/41845.jpg,TV,Manga,25,Finished Airing,False,"Oct 6, 2012 to Mar 30, 2013","{'from': '2012-10-06', 'to': '2013-03-30'}",24 min. per ep.,PG-13 - Teens 13 or older,8.67,107767,50.0,426,182765,2082,,Fall 2012,Unknown,"{'Adaptation': [{'mal_id': 9711, 'type': 'manga', 'url': 'https://myanimelist.net/manga/9711/Bakuman', 'title': 'Bakuman.'}], 'Prequel': [{'mal_id': 10030, 'type': 'anime', 'url': 'https://myanimelist.net/anime/10030/Bakuman_2nd_Season', 'title': 'Bakuman. 2nd Season'}, {'mal_id': 15711, 'type': 'anime', 'url': 'https://myanimelist.net/anime/15711/Bakuman__Deraman', 'title': 'Bakuman.: Deraman.'}], 'Other': [{'mal_id': 23361, 'type': 'anime', 'url': 'https://myanimelist.net/anime/23361/Bakuman_3rd_Season_Specials', 'title': 'Bakuman. 3rd Season Specials'}]}","NHK, Shueisha",,J.C.Staff,"Comedy, Drama, Romance, Shounen","['#1: ""Moshimo no Hanashi (もしもの話)"" by nano.RIPE (eps 1-13)', '#2: ""23:40 (23時40分) feat. Base Ball Bear"" by Hyadain (eps 14-25)']","['#1: ""Pride on Everyday"" by Sphere (eps 1-13)', '#2: ""Yume Sketch (夢スケッチ)"" by JAM Project (eps 14-24)', '#3: ""Moshimo no Hanashi (もしもの話)"" by nano.RIPE (ep 25)']",24.0,2012.0,8.66845521633726,8084,0.9840486555912242,0.9507676019057703,0.8646148089246457,0.9238122519191413
9926,Sekaiichi Hatsukoi,Sekai Ichi Hatsukoi - World&#039;s Greatest First Love,世界一初恋 TV,"Sekai-ichi Hatsukoi, Sekai&#039;ichi Hatsukoi, World&#039;s Greatest First Love",https://myanimelist.cdn-dena.com/images/anime/6/29763.jpg,TV,Manga,12,Finished Airing,False,"Apr 9, 2011 to Jun 25, 2011","{'from': '2011-04-09', 'to': '2011-06-25'}",23 min. per ep.,PG-13 - Teens 13 or older,8.07,69250,469.0,701,121752,2908,,Spring 2011,Unknown,"{'Adaptation': [{'mal_id': 10573, 'type': 'manga', 'url': 'https://myanimelist.net/manga/10573/Sekaiichi_Hatsukoi__Onodera_Ritsu_no_Baai', 'title': 'Sekaiichi Hatsukoi: Onodera Ritsu no Baai'}], 'Spin-off': [{'mal_id': 3092, 'type': 'anime', 'url': 'https://myanimelist.net/anime/3092/Junjou_Romantica', 'title': 'Junjou Romantica'}], 'Side story': [{'mal_id': 8063, 'type': 'anime', 'url': 'https://myanimelist.net/anime/8063/Sekaiichi_Hatsukoi_OVA', 'title': 'Sekaiichi Hatsukoi OVA'}], 'Sequel': [{'mal_id': 11123, 'type': 'anime', 'url': 'https://myanimelist.net/anime/11123/Sekaiichi_Hatsukoi_2', 'title': 'Sekaiichi Hatsukoi 2'}], 'Other': [{'mal_id': 20371, 'type': 'anime', 'url': 'https://myanimelist.net/anime/20371/Sekaiichi_Hatsukoi_Movie__Yokozawa_Takafumi_no_Baai', 'title': 'Sekaiichi Hatsukoi Movie: Yokozawa Takafumi no Baai'}]}","Lantis, Kadokawa Shoten, AT-X, DAX Production, KlockWorx",Funimation,Studio Deen,"Comedy, Drama, Romance, Shounen Ai","['""Sekai de Ichiban Koishiteru (世界で一番恋してる)"" by Shuuhei Kita']","['""Ashita, Boku wa Kimi ni Ai ni Iku. (明日、僕は君に会いに行く。)"" by Wakaba (ワカバ)']",23.0,2011.0,8.068462419908453,7262,0.9159688673828053,1.0,0.8297488189344685,0.9060868364847003
9863,SKET Dance,SKET Dance,スケットダンス,,https://myanimelist.cdn-dena.com/images/anime/9/73974.jpg,TV,Manga,77,Finished Airing,False,"Apr 7, 2011 to Sep 27, 2012","{'from': '2011-04-07', 'to': '2012-09-27'}",24 min. per ep.,PG-13 - Teens 13 or older,8.33,44132,213.0,646,130264,2474,,Spring 2011,Thursdays at 18:00 (JST),"{'Adaptation': [{'mal_id': 1414, 'type': 'manga', 'url': 'https://myanimelist.net/manga/1414/SKET_Dance', 'title': 'SKET Dance'}], 'Character': [{'mal_id': 9969, 'type': 'anime', 'url': 'https://myanimelist.net/anime/9969/Gintama', 'title': 'Gintama&#039;'}], 'Summary': [{'mal_id': 10775, 'type': 'anime', 'url': 'https://myanimelist.net/anime/10775/SKET_Dance__Tettei_Bunseki_Special', 'title': 'SKET Dance: Tettei Bunseki Special'}], 'Side story': [{'mal_id': 16395, 'type': 'anime', 'url': 'https://myanimelist.net/anime/16395/SKET_Dance_OVA', 'title': 'SKET Dance OVA'}], 'Other': [{'mal_id': 16718, 'type': 'anime', 'url': 'https://myanimelist.net/anime/16718/SKET_Dance__SD_Character_Flash_Anime', 'title': 'SKET Dance: SD Character Flash Anime'}]}","TV Tokyo, Avex Entertainment, Dentsu",,Tatsunoko Production,"Comedy, School, Shounen","['#01: ""Kakko Warui I love you! (カッコ悪いI love you!)"" by French Kiss (eps 2-17)', '#02: ""Michi (道)"" by The Sketchbook (eps 18-26)', '#03: ""Graffiti"" by Gackt (eps 27-39)', '#04: ""Message"" by The Sketchbook (eps 40-46, 48-51)', '#05: ""Reboot"" by everset (eps 53-63)', '#06: ""Clear"" by The Sketchbook (eps 65-76)']","['#01: ""Kakko Warui I love you! (カッコ悪いI love you!)"" by French Kiss (ep 1, 51)', '#02: ""Comic Sonic"" by The Pillows (eps 2-16)', '#03: ""Funny Bunny (Rock Stock Version)"" by The Pillows (ep 17)', '#04: ""Clover (クローバー)"" by The Sketchbook (eps 18-24, 26)', '#05: ""Kioku (キヲク)"" by The Sketchbook (eps 25)', '#06: ""Milk to Chocolate (ミルクとチョコレート)"" by ChocoLe (eps 27-36, 38-39)', '#07: ""HERO"" by The Sketchbook (ep 37)', '#08: ""Party! Hallelujah! (パーリー!ハレルヤ!)"" by SKET ROCK (Yusuke Fujisaki [CV: Hiroyuki Yoshino], Sasuke Tsubaki [CV: Hiro Shimono], Kazuyoshi Usui [CV: Tomokazu Sugita], Soujirou Agata [CV: Tomokazu Seki]) (eps 40-46, 49-50)', '#09: ""Message"" by The Sketchbook (ep 47)', '#10: ""Birthday"" by The Sketchbook (ep 48)', '#11: ""Colors"" by The Sketchbook (ep 52-61, 63)', '#12: ""Sekai wa Okujou de Miwataseta (世界は屋上で見渡せた)"" by SKET x Sketch (eps 65-69, 71-72, 74-75)', '#13: ""Sekai wa Okujou de Miwataseta: Gasshou Ver. (世界は屋上で見渡せた ~合唱 Ver.~)"" by Kaimei Gakuen Seitokai Shikko-bu (開盟学園生徒会執行部) (ep 70)', '#14: ""Startup"" by The Sketchbook (ep 77)']",24.0,2011.0,8.327001465469598,7407,0.9333415372948779,0.9481206987824247,0.5951073483324758,0.8172679628552268
30694,Dragon Ball Super,Dragon Ball Super,ドラゴンボール超（スーパー）,"Dragon Ball Chou, DB Super, DBS",https://myanimelist.cdn-dena.com/images/anime/7/74606.jpg,TV,Manga,131,Finished Airing,False,"Jul 5, 2015 to Mar 25, 2018","{'from': '2015-07-05', 'to': '2018-03-25'}",23 min. per ep.,PG-13 - Teens 13 or older,7.78,102780,922.0,278,250101,4314,The first 27 episodes are adaptations of the films Dragon Ball Z Movie 14: Kami to Kami (episodes 1-14) and Dragon Ball Z Movie 15: Fukkatsu no F (episodes 15-27).,Summer 2015,Sundays at 09:00 (JST),"{'Adaptation': [{'mal_id': 89734, 'type': 'manga', 'url': 'https://myanimelist.net/manga/89734/Dragon_Ball_Super', 'title': 'Dragon Ball Super'}], 'Parent story': [{'mal_id': 813, 'type': 'anime', 'url': 'https://myanimelist.net/anime/813/Dragon_Ball_Z', 'title': 'Dragon Ball Z'}, {'mal_id': 22777, 'type': 'anime', 'url': 'https://myanimelist.net/anime/22777/Dragon_Ball_Kai_2014', 'title': 'Dragon Ball Kai (2014)'}], 'Character': [{'mal_id': 2222, 'type': 'anime', 'url': 'https://myanimelist.net/anime/2222/Dr_Slump__Arale-chan', 'title': 'Dr. Slump: Arale-chan'}], 'Alternative version': [{'mal_id': 14837, 'type': 'anime', 'url': 'https://myanimelist.net/anime/14837/Dragon_Ball_Z_Movie_14__Kami_to_Kami', 'title': 'Dragon Ball Z Movie 14: Kami to Kami'}, {'mal_id': 25389, 'type': 'anime', 'url': 'https://myanimelist.net/anime/25389/Dragon_Ball_Z_Movie_15__Fukkatsu_no_F', 'title': 'Dragon Ball Z Movie 15: Fukkatsu no F'}], 'Sequel': [{'mal_id': 36946, 'type': 'anime', 'url': 'https://myanimelist.net/anime/36946/Dragon_Ball_Super_Movie', 'title': 'Dragon Ball Super Movie'}]}","Yomiko Advertising, Fuji TV",Funimation,Toei Animation,"Action, Adventure, Comedy, Fantasy, Martial Arts, Shounen, Super Power","['#1: ""Chouzetsu☆Dynamic! (超絶☆ダイナミック!)"" by Kazuya Yoshii (吉井和哉) (eps 1-76)', '#2: ""Genkai Toppa × Survivor (限界突破×サバイバー)"" by Kiyoshi Hikawa (氷川きよし) (eps 77- )']","['#01: ""Hello Hello Hello (ハローハローハロー)"" by Good Morning America (eps 1-12)', '#02: ""Starring Star (スターリングスター)"" by KEYTALK (eps 13-25)', '#03: ""Usubeni (薄紅)"" by LACCO TOWER (eps 26-36)', '#04: ""Forever Dreaming"" by Czecho No Republic (eps 37-49)', '#05: ""Yoka-Yoka Dance (よかよかダンス)"" by Batten Shoujo-tai (ばってん少女隊) (eps 50-59)', '#06: ""Chaohan MUSIC (炒飯MUSIC)"" by Arukara (60-72)', '#07: ""Aku no Tenshi to Seigi no Akuma"" by THE COLLECTORS (73-83)', '#08: ""Boogie Back"" by Miyu Inoue (井上実優) (eps 84-96)', '#09: ""Haruka (遥)"" by LACCO TOWER (eps 97-108)', '#10: ""70cm Shiho no Madobe (70cm四方の窓辺)"" by ROTTENGRAFFTY (eps 109-121)', '#11: ""LAGRIMA"" by ONEPIXCEL (eps 122-?)']",23.0,2015.0,7.779245420107419,8603,0.8898849056703009,0.9862361037586025,0.5990177276766921,0.8167957832448465
6586,Yume-iro Pâtissière,,夢色パティシエール,"Yumeiro Patissiere, YumePati, Dream-Colored Pastry Chef, Yumeiro Pâtissière",https://myanimelist.cdn-dena.com/images/anime/12/21674.jpg,TV,Manga,50,Finished Airing,False,"Oct 4, 2009 to Sep 26, 2010","{'from': '2009-10-04', 'to': '2010-09-26'}",24 min. per ep.,G - All Ages,8.03,21618,526.0,1630,45625,826,,Fall 2009,Unknown,"{'Adaptation': [{'mal_id': 10386, 'type': 'manga', 'url': 'https://myanimelist.net/manga/10386/Yume-iro_Pâtissière', 'title': 'Yume-iro Pâtissière'}], 'Side story': [{'mal_id': 8894, 'type': 'anime', 'url': 'https://myanimelist.net/anime/8894/Yume-iro_Pâtissière__Mune_Kyun_Tropical_Island', 'title': 'Yume-iro Pâtissière: Mune Kyun Tropical Island!'}], 'Sequel': [{'mal_id': 9441, 'type': 'anime', 'url': 'https://myanimelist.net/anime/9441/Yume-iro_Pâtissière_SP_Professional', 'title': 'Yume-iro Pâtissière SP Professional'}]}","Yomiuri Telecasting, DAX Production, Shueisha",,"Studio Pierrot, Studio Hibari","Kids, School, Shoujo","['""Yume ni Yell! Patissiere♪ (夢にエール！パティシエール♪)"" by Mayumi Gojou']","['""Ichigo no Miracle (いちごのミラクルール)"" by Yukina Sugihara']",24.0,2009.0,8.025274372439968,5155,0.9796804031814503,0.8905946709017117,0.6022264839328313,0.8159255141452779
857,Air Gear,Air Gear,エア・ギア,,https://myanimelist.cdn-dena.com/images/anime/11/18227.jpg,TV,Manga,25,Finished Airing,False,"Apr 5, 2006 to Sep 27, 2006","{'from': '2006-04-05', 'to': '2006-09-27'}",24 min. per ep.,R+ - Mild Nudity,7.64,126326,1233.0,297,235764,3254,,Spring 2006,Unknown,"{'Adaptation': [{'mal_id': 74, 'type': 'manga', 'url': 'https://myanimelist.net/manga/74/Air_Gear', 'title': 'Air Gear'}], 'Side story': [{'mal_id': 3791, 'type': 'anime', 'url': 'https://myanimelist.net/anime/3791/Air_Gear_Special', 'title': 'Air Gear Special'}], 'Sequel': [{'mal_id': 9201, 'type': 'anime', 'url': 'https://myanimelist.net/anime/9201/Air_Gear__Kuro_no_Hane_to_Nemuri_no_Mori_-_Break_on_the_Sky', 'title': 'Air Gear: Kuro no Hane to Nemuri no Mori - Break on the Sky'}]}","Marvelous, Kodansha","ADV Films, Funimation",Toei Animation,"Action, Comedy, Ecchi, Shounen, Sports","['""Chain"" by Back-on']","['""Sky-2-High"" by skankfunk']",24.0,2006.0,7.639496692299457,8524,0.9260809964864054,0.9099170637021352,0.46812292436503117,0.7603599249026788
1735,Naruto: Shippuuden,Naruto: Shippuden,ナルト- 疾風伝,Naruto Hurricane Chronicles,https://myanimelist.cdn-dena.com/images/anime/5/17407.jpg,TV,Manga,500,Finished Airing,False,"Feb 15, 2007 to Mar 23, 2017","{'from': '2007-02-15', 'to': '2017-03-23'}",23 min. per ep.,PG-13 - Teens 13 or older,8.18,385179,337.0,20,794112,42846,,Winter 2007,Thursdays at 19:30 (JST),"{'Adaptation': [{'mal_id': 11, 'type': 'manga', 'url': 'https://myanimelist.net/manga/11/Naruto', 'title': 'Naruto'}, {'mal_id': 86129, 'type': 'manga', 'url': 'https://myanimelist.net/manga/86129/Naruto_Hiden_Series', 'title': 'Naruto Hiden Series'}, {'mal_id': 90531, 'type': 'manga', 'url': 'https://myanimelist.net/manga/90531/Naruto_Shinden_Series', 'title': 'Naruto Shinden Series'}], 'Prequel': [{'mal_id': 20, 'type': 'anime', 'url': 'https://myanimelist.net/anime/20/Naruto', 'title': 'Naruto'}], 'Side story': [{'mal_id': 2472, 'type': 'anime', 'url': 'https://myanimelist.net/anime/2472/Naruto__Shippuuden_Movie_1', 'title': 'Naruto: Shippuuden Movie 1'}, {'mal_id': 4437, 'type': 'anime', 'url': 'https://myanimelist.net/anime/4437/Naruto__Shippuuden_Movie_2_-_Kizuna', 'title': 'Naruto: Shippuuden Movie 2 - Kizuna'}, {'mal_id': 6325, 'type': 'anime', 'url': 'https://myanimelist.net/anime/6325/Naruto__Shippuuden_Movie_3_-_Hi_no_Ishi_wo_Tsugu_Mono', 'title': 'Naruto: Shippuuden Movie 3 - Hi no Ishi wo Tsugu Mono'}, {'mal_id': 8246, 'type': 'anime', 'url': 'https://myanimelist.net/anime/8246/Naruto__Shippuuden_Movie_4_-_The_Lost_Tower', 'title': 'Naruto: Shippuuden Movie 4 - The Lost Tower'}, {'mal_id': 10589, 'type': 'anime', 'url': 'https://myanimelist.net/anime/10589/Naruto__Shippuuden_Movie_5_-_Blood_Prison', 'title': 'Naruto: Shippuuden Movie 5 - Blood Prison'}, {'mal_id': 13667, 'type': 'anime', 'url': 'https://myanimelist.net/anime/13667/Naruto__Shippuuden_Movie_6_-_Road_to_Ninja', 'title': 'Naruto: Shippuuden Movie 6 - Road to Ninja'}, {'mal_id': 16870, 'type': 'anime', 'url': 'https://myanimelist.net/anime/16870/The_Last__Naruto_the_Movie', 'title': 'The Last: Naruto the Movie'}, {'mal_id': 32365, 'type': 'anime', 'url': 'https://myanimelist.net/anime/32365/Boruto__Naruto_the_Movie_-_Naruto_ga_Hokage_ni_Natta_Hi', 'title': 'Boruto: Naruto the Movie - Naruto ga Hokage ni Natta Hi'}], 'Spin-off': [{'mal_id': 4134, 'type': 'anime', 'url': 'https://myanimelist.net/anime/4134/Naruto_Shippuuden__Shippuu_Konoha_Gakuen_Den', 'title': 'Naruto Shippuuden: Shippuu! ""Konoha Gakuen"" Den'}, {'mal_id': 12979, 'type': 'anime', 'url': 'https://myanimelist.net/anime/12979/Naruto_SD__Rock_Lee_no_Seishun_Full-Power_Ninden', 'title': 'Naruto SD: Rock Lee no Seishun Full-Power Ninden'}], 'Other': [{'mal_id': 10075, 'type': 'anime', 'url': 'https://myanimelist.net/anime/10075/Naruto_x_UT', 'title': 'Naruto x UT'}, {'mal_id': 19511, 'type': 'anime', 'url': 'https://myanimelist.net/anime/19511/Naruto_Shippuuden__Sunny_Side_Battle', 'title': 'Naruto Shippuuden: Sunny Side Battle'}], 'Sequel': [{'mal_id': 28755, 'type': 'anime', 'url': 'https://myanimelist.net/anime/28755/Boruto__Naruto_the_Movie', 'title': 'Boruto: Naruto the Movie'}, {'mal_id': 34566, 'type': 'anime', 'url': 'https://myanimelist.net/anime/34566/Boruto__Naruto_Next_Generations', 'title': 'Boruto: Naruto Next Generations'}]}","TV Tokyo, Aniplex, KSS, Rakuonsha, TV Tokyo Music, Shueisha",Viz Media,Studio Pierrot,"Action, Adventure, Comedy, Super Power, Martial Arts, Shounen","['#01: ""Hero&#039;s Come Back"" by Nobodyknows+ (eps 1-30)', '#02: ""distance"" by LONG SHOT PARTY (eps 31-53)', '#03: ""Blue Bird (ブルーバード)"" by Ikimonogakari (eps 54-77)', '#04: ""CLOSER"" by Inoue Joe (eps 78-102)', '#05: ""Hotaru no Hikari (ホタルノヒカリ)"" by Ikimonogakari (eps 103-128)', '#06: ""Sign"" by FLOW (eps 129-153)', '#07: ""Toumei Datta Sekai (透明だった世界)"" by Motohiro Hata (eps 154-179)', '#08: ""Diver"" by NICO Touches the Walls (eps 180-205)', '#09: ""Lovers (ラヴァーズ)"" by 7!! (eps 206-230)', '#10: ""newsong"" by tacica (eps 231-256)', '#11: ""Totsugeki Rock (突撃ロック)"" by THE CRO-MAGNONS (eps 257-281)', '#12: ""Moshimo"" by Daisuke (eps 282-306)', '#13: ""Niwaka Ame Nimo Makezu (ニワカ雨ニモ負ケズ)"" by NICO Touches the Walls (eps 307-332)', '#14: ""Tsuki no Ookisa (月の大きさ)"" by Nogizaka46 (eps 333-356)', '#15: ""Guren"" by DOES (eps 357-379)', '#16: ""Silhouette (シルエット)"" by KANA-BOON (eps 380-405)', '#17: ""Kaze (風)"" by Yamazaru (eps 406-431)', '#18: ""LINE"" by Sukima Switch (eps 432-458)', '#19: ""Blood Circulator (ブラッドサーキュレーター)"" by Asian Kung-Fu Generation (eps 459-479)', '#20: ""Kara no Kokoro (カラノココロ)"" by Anly (eps 480-500)']","['#01: ""Nagare Boshi ~Shooting Star~ (流れ星〜Shooting Star〜)"" by HOME MADE Kazoku (eps 1-18)', '#02: ""Michi ~to you all (道 〜to you all)"" by aluto (eps 19-30)', '#03: ""KIMI MONOGATARI (キミモノガタリ)"" by little by little (eps 31-41)', '#04: ""Mezamero! Yasei (目覚めろ!野性)"" by MATCHY with QUESTION? (eps 42-52)', '#05: ""Sunao na Niji (素直な虹)"" by surface (eps 54-63)', '#06: ""BROKEN YOUTH"" by Nico Touches the Walls (eps 64-77)', '#07: ""Long Kiss Goodbye"" by HALCALI (eps 78-90)', '#08: ""BACCHIKOI!!! (バッチコイ!!!)"" by DEV PARADE (eps 91-102)', '#09: ""Shinkokyuu (深呼吸)"" by SUPER BEAVER (eps 103-115)', '#10: ""My ANSWER"" by SEAMO (eps 116-128)', '#11: ""Omae Dattanda (おまえだったんだ)"" by Kishidan (eps 129-141)', '#12: ""For You"" by AZU (eps 142-153)', '#13: ""Jitensha (自転車)"" by OreSkaBand (eps 154-166)', '#14: ""Utakata Hanabi (うたかた花火)"" by supercell (eps 167-179)', '#15: ""U can do it!"" by DOMINO (eps 180-192)', '#16: ""Mayonaka no Orchestra (真夜中のオーケストラ)"" by Aqua Timez (eps 193-205)', '#17: ""FREEDOM"" by HOME MADE Kazoku (eps 206-218)', '#18: ""Yokubou o Sakebe!!!! (欲望を叫べ!!!!)"" by OKAMOTO&#039;S (eps 219-230)', '#19: ""Place to Try"" by TOTALFAT (eps 231-242)', '#20: ""By My Side (バイマイサイド)"" by Hemenway (eps 243-256)', '#21: ""Cascade (カスケード)"" by UNLIMITS (eps 257-268)', '#22: ""Kono Koe Karashite (この声枯らしてfeat. CHEHON)"" by AISHA feat. CHEHON (eps 269-281)', '#23: ""MOTHER"" by MUCC (eps 282-295)', '#24: ""Sayonara Memory (さよならメモリー)"" by 7!! (eps 296-306)', '#25: ""I Can Hear"" by DISH// (eps 307-319)', '#26: ""Yume wo Daite ~Hajimari no Crissroad~ (夢を抱いて〜はじまりのクリスロード〜)"" by Rake (eps 320-332)', '#27: ""Black Night Town (ブラックナイトタウン)"" by Akihisa Kondou (eps 333-343)', '#28: ""Niji (虹)"" by Shinkuu Horou (真空ホロウ) (eps 344-356)', '#29: ""FLAME"" by DISH// (eps 357-366)', '#30: ""Never Change feat.Lyu:Lyu"" by SHUN (eps 367-379)', '#31: ""Dame Dame da (だめだめだ)"" by Shiori Tomita (eps 380-393)', '#32: ""Spinning World"" by Diana Garnet (eps 394-405)', '#33: ""Kotoba no Iranai Yakusoku (言葉のいらない約束)"" by sana (eps 406-417)', '#34: ""Niji no Sora (虹の空)"" by FLOW (eps 418-431)', '#35: ""Trouble Maker (トラブルメイカー)"" by KANIKAPILA (eps 432-443)', '#36: ""Sonna Kimi, Konna Boku (そんな君、こんな僕)"" by Thinking Dogs (eps 444-454)', '#37: ""Ao no Lullaby (青のララバイ)"" by Kuroneko Chelsea (eps 455-466)', '#38: ""Pino to Amélie (ピノとアメリ)"" by Huwie Ishizaki (eps 467-479)', '#39: ""Tabidachi no Uta (旅立ちの唄)"" by Ayumikurikamaki (eps 480-488)', '#40: ""Zetsu Zetsu (『絶絶（ぜつぜつ）)"" by Swimy (eps 489-500)']",23.0,2007.0,8.179694685722946,10358,0.9565175644189294,0.9119463560967003,0.4137705224753263,0.7531373661870155
